city,country,name,host_since,host_response_rate,host_identity_verified,review,superhost,property_type,accomodates,number_bathroom,number_bedroom,number_beds,rating,price,cleanliness,accuracy,communication,location,check_in,value
Nor Hachn,Armenia,"House in Armenia, Lusakert",2018.0,100.0,Identity not verified,14.0,Super host,Entire villa,6.0,2.0,2.0,2.0,4.92,120.0,5.0,4.9,4.9,4.8,4.7,4.7
Jraber,Armenia,Peaceful getaway in the nature,2016.0,100.0,Identity verified,85.0,Super host,Private room in cottage,2.0,3.0,2.0,4.0,0.0,59.0,,,,,,
Yerevan,Armenia,Sweet home,2019.0,81.0,Identity verified,1.0,regular host,Entire residential home,7.0,3.5,4.0,6.0,0.0,250.0,,,,,,
Abovyan,Armenia,Holiday home in Nurnus,2016.0,,Identity verified,0.0,regular host,Entire residential home,8.0,2.0,4.0,7.0,0.0,100.0,,,,,,
Getamej,Armenia,"HAYA House, Chill out 20mn from Yerevan, #1",2013.0,,Identity verified,27.0,regular host,Private room in bed and breakfast,2.0,1.0,1.0,2.0,0.0,18.0,,,,,,
Abovyan,Armenia,Home dacha,2016.0,0.0,Identity not verified,1.0,regular host,Private room in residential home,16.0,2.0,1.0,10.0,0.0,400.0,,,,,,
